audio,transcript
adapt_sample_2376_noisy,بو
adapt_sample_2377_noisy,ربنا كرمك
adapt_sample_2378_noisy,تتعمل الطشه أه تيجي بقى تحط الملوخيه ثانيه واحده لأ الشقه دي لازم تتعمل لازم
adapt_sample_2379_noisy,حامل كرش
adapt_sample_2380_noisy,أه اللي إنت شايفه بقى
adapt_sample_2381_noisy,لأن الجو شويه شمس بترابه شويه الشمس تروح ولحد دلوقتي حتى الجو إنك انت تقول إيه هشمس مش موجود فالسوق كده زي ما إنتو شايفين و ده لحد دلوقتي
adapt_sample_2382_noisy,البطه قاعده بتوحد ربنا فيها
adapt_sample_2383_noisy,أهو
adapt_sample_2384_noisy,سألت فين
adapt_sample_2385_noisy,بنقعد على القهوه نقعد في حته لكن ما بنقعدش معا بنات احنا ليه
adapt_sample_2386_noisy,هنجيبها هنا كده
adapt_sample_2387_noisy,هنا مصنع الرجال تعالى يا أحمد دي الطعميه طبعا انا بوري للناس اللي هي مشافتش ده قبل كده يعني
adapt_sample_2388_noisy,ذكرياتي
adapt_sample_2389_noisy,مشغوله عشان مبهدلني خالص
adapt_sample_2390_noisy,و غاب بقى برضو بنفس الإيه
adapt_sample_2391_noisy,طب أنا استأذنت خدوهم أهو
adapt_sample_2392_noisy,أه الحتت الطريه دي الوليمه دي وبرضو بديله حسابك مقليه سليمه كده يعني متبخلش عليه ده برضو حبيبنا وهنظبطه هنظبطه
adapt_sample_2393_noisy,افصل الراوتر وشغله من تاني
adapt_sample_2394_noisy,البطاطس معروفه بإسم
adapt_sample_2395_noisy,هنتكلم عن فزاعة الغيه يا جماعه فزاعة الغيه أو فزاعة المكان اللي انت بتربى فيه الحمام
adapt_sample_2396_noisy,أه
adapt_sample_2397_noisy,فخلاص عملت خمس تيام في الفندق اللي في روما طب تاريخ الطيران إمتى بقى بعد خمس تيام هروح أنا إيه هروح ميلان هعمل تاريخ بقى يعني أنا مثلا هعمل تشيك أوت مثلا من روما تاريخ يوم مثلا خمسه
adapt_sample_2398_noisy,من أكتر الحاجات اللي مشهور بيها يا عم محمد
adapt_sample_2399_noisy,يا خبر
adapt_sample_2400_noisy,حقك عليا
adapt_sample_2401_noisy,بسم الله الرحمن الرحيم
adapt_sample_2402_noisy,ليه كده ما انا بوظت الدنيا
adapt_sample_2403_noisy,أقسم بالله
adapt_sample_2404_noisy,يعني حاجه هي في حد ذاتها أنا عن نفسي أنا
adapt_sample_2405_noisy,أيوه إنك تحب واحده
adapt_sample_2406_noisy,خلاص يا بابا حقك عليا والله ما هكلمك مسجل في التليفزيون
adapt_sample_2407_noisy,تعالى يا أحمد وهدخلكوا جوه هتفراجكو على شوية تفاصيل
adapt_sample_2408_noisy,هتعرفوا ال ال الترافك اللي ورايا و الطوابير بتاع مدينة نصر دي جايه منين يعني تعالى يا أحمد
adapt_sample_2409_noisy,بسم الله الرحمن الرحيم اكل البطه
adapt_sample_2410_noisy,يعني أيه
adapt_sample_2411_noisy,ده بقى اللي خرب الدنيا عند عمك موسى ومدمر الدنيا
adapt_sample_2412_noisy,المواضيع دي صح
adapt_sample_2413_noisy,ألف ألف كلام
adapt_sample_2414_noisy,هيطول
adapt_sample_2415_noisy,تمام بعد روما هعمل إيه طيران داخلي
adapt_sample_2416_noisy,و امسك له الفهد ده و ربنا يقدم اللي في الخير يعني لو فهد بقى و تعالى إن شاء الله بإذن الله نمسكوه و نجاملوا الراجل صحابنا و نبعدوا عن الحاجه اللي فيه تضرهم و إن شاء الله مع بعض دايما كده
adapt_sample_2417_noisy,بيسيبه لما يكبر يبقى عمره أسبوع وبيبدأ يقرقش فيه بمزاجه طب احنا هنقاوم ازاي بقى دلوقتي يا عم سليمان
adapt_sample_2418_noisy,متقولوش بقى سيبوا بقى
adapt_sample_2419_noisy,لأ مقولتش بس
adapt_sample_2420_noisy,لأ
adapt_sample_2421_noisy,أه المفروض
adapt_sample_2422_noisy,ياسطى هاخدها معايا وانا ماشي
adapt_sample_2423_noisy,ودايما إن شاء الله أقرب موعد
adapt_sample_2424_noisy,شكلا أه مش اسما كمان بجد والله
adapt_sample_2425_noisy,لا لا مفيش مفكرتش
adapt_sample_2426_noisy,بس أنا بديك النصيحه إن إنت لو أول مره تعمل زي ما أنا بقولك
adapt_sample_2427_noisy,في حاجه هنا مش فاهمها المهم عشان مطولش الفيديو أكتر من كده
adapt_sample_2428_noisy,أبدا
adapt_sample_2429_noisy,فجاي بيقولي إرسمي حاجات كده هو أنا رسمت اللي مش موجود في المنهج وقعدت أقلب بقى المركب من دماغي وحطله هنا
adapt_sample_2430_noisy,بواقي الأكل بتاعك هتجيبهوله كده ماشي يا جماعه يبقى بواقي الأكل بتاعك هتجيبهم بس أهم حاجه يكون سمك مقلي عشان هو بيحب إيه ياكل السمك المقلي يعني بيحبه جدا سبحان الله
adapt_sample_2431_noisy,تعرف تقول بوك بصوت كلب
adapt_sample_2432_noisy,أه طيب
adapt_sample_2433_noisy,خلطه
adapt_sample_2434_noisy,دي طعميه وهي بتتعمل هنا لقيتهم بيعملوا طعميه بالبسطرمه بقولك ايه
adapt_sample_2435_noisy,علشان خاطر تعمل صوت لا
adapt_sample_2436_noisy,البيض المسلوق
adapt_sample_2437_noisy,ماشي و في مكان مهجور هنا في عند النخل و إيه و المكان المهجور اللي جوه ده و إن شاء الله بإذن الله نحاول نحطله لجوه و نوصله لجوه
adapt_sample_2438_noisy,أعزائنا المشاهدين إحنا طبعا جينا شوفنا المكان اللي موجود فيه الفهد ده بقى أو التعلب هو عند الترعه الكبيره خالص دي
adapt_sample_2439_noisy,إيه
adapt_sample_2440_noisy,حاضر يا عم حاضر يا عم وسألنا ليك
adapt_sample_2441_noisy,أنا بشكر أبناء مصر الأعزاء وبشكر ولادي اللي مشرفني في كل مكان
adapt_sample_2442_noisy,لأن أنت بتبقى قاعد في البيت حلو جعان إنت بتضطر تعمل إيه تروح مكلم أقرب صديق ليك الدليفري حلو
adapt_sample_2443_noisy,هقولك معلش
adapt_sample_2444_noisy,اللي ما يتسموا
adapt_sample_2445_noisy,وهتجيب ماسوره زي دي طب يا عم سليمان أنا ما عنديش ماسوره ماسوره اتنين بوصه أهي أو بوصه
adapt_sample_2446_noisy,فإنت مضطر إن أنت تشتغل أي شغل لحد ما ربنا يجعلك نصيب في شغلانه أحسن المكتب ده بقى بيعمل إيه بيساعدك في الأوراق بيجيبلك شغل لو جابلك شغل وخدت عقد بقيت الأوراق كلها سهله حتى لو معملتش ولا ورقه في البرتغال
adapt_sample_2447_noisy,إسمها إيه الجيجا و لكن في مكاتب كتير في مناطق كتير بس أنا بكلمك على المكان ده في السنتر اللي تقدر إن انت تروح مثلا لو انت جاي في الإسبوع هيبقى أقرب مكان ليك
adapt_sample_2448_noisy,يا نهار ازرق
adapt_sample_2449_noisy,عنده اتنين وعشرين سنه
adapt_sample_2450_noisy,الحب حلو
adapt_sample_2451_noisy,و إن شاء الله بعد كده بط البط بتاعك و الفراخ بتاعتك تبقى في أمان بس حاول تحبش عليها شويه
adapt_sample_2452_noisy,عملت إيه بس
adapt_sample_2453_noisy,والله لسه
adapt_sample_2454_noisy,أه
adapt_sample_2455_noisy,اطلع على بلجيكا و بعدين اطلع على ألمانيا لا يا حبيبي إنت مش مليونير إنت أول مره تاخد الكلام ده لو إنت واخدها قبل كده بقى يبقى أعمل الكلام ده
adapt_sample_2456_noisy,بسم الله
adapt_sample_2457_noisy,حب يعني غرام ود محبه خصام
adapt_sample_2458_noisy,شوفتوا الكوبري اللي في وشي ده هاخد انا بقى إيه شمال تمام تفضل بقى إيه ماشي في طريقك على طول أهو تحت منك الكوبري و على شمالك شايفين مجدنا
adapt_sample_2459_noisy,كل مانربي بطتين
adapt_sample_2460_noisy,مش عايزها عنيها خضره مثلا شعرها اصفر لا
adapt_sample_2461_noisy,سرسجي
adapt_sample_2462_noisy,أه
adapt_sample_2463_noisy,و في الفيديو ده بقى هشرحلك تعمل إيه بالظبط على قد إمكانياتك
adapt_sample_2464_noisy,طلع إيه
adapt_sample_2465_noisy,تعرف تقول بوك بصوت عصفوره
adapt_sample_2466_noisy,قلت أنا مش هقبل على نفسي غير إني أكون مهندس طيران حتى لو مش هشتغل بيها
adapt_sample_2467_noisy,أبعتهولك فين
adapt_sample_2468_noisy,و هنفضي الكيسه بجنيه أوفر
adapt_sample_2469_noisy,علشان إيه يعني يكرمنا فربنا يقدم اللي فيه الخير
adapt_sample_2470_noisy,و لازم تكون جامعه حكوميه معتمده و كمان موجوده في التصنيف العالمي وبرسوم قليله في السنه تمنميه تلاته و عشرين يورو واتناشر
adapt_sample_2471_noisy,عشان الملل
adapt_sample_2472_noisy,محمد
adapt_sample_2473_noisy,استنى خلي بالك
adapt_sample_2474_noisy,خلص كام كام
adapt_sample_2475_noisy,احترام عن احترام تفرق
adapt_sample_2476_noisy,كانت بنخبط على كرشك كده أيوه عشان الكرش
adapt_sample_2477_noisy,تقريبا تمن ساعات
adapt_sample_2478_noisy,وفي كمان حاجه إسمها سم فحار وده أخطر بس خلي بالكو أنا بمسك الحاجه بإيدي عشان أنا أنا حاذر وعارف أنا بعمل إيه
adapt_sample_2479_noisy,كنت هكمل بقى وقولت عليها تاني في الدور التحتاني وبتاع بس قطمتها بيني وبينك وقولت
adapt_sample_2480_noisy,بقية الكوبري طبعا هما بيجددوا ناحيه وسايبين ناحيه زي ما إنتو شايفين هو ده التجديد دلوقتي
adapt_sample_2481_noisy,حبيبي أنا أقولك على حاجه
adapt_sample_2482_noisy,كشك
adapt_sample_2483_noisy,طبعا بس التميز هو إن أكتر حاجه سألتك عليها إيه
adapt_sample_2484_noisy,يفترس النمس نفسه فإن شاء الله بإذن الجر بإذن الله الجره دي كده
adapt_sample_2485_noisy,أنا مش شايف نفسي سرسجي
adapt_sample_2486_noisy,قولي أربع أغاني كده لعبد الحليم
adapt_sample_2487_noisy,إيه عملت إيه
adapt_sample_2488_noisy,وعمل لايك جميل عشان الفيديو أكتر الناس تشوفه إن شاء الله
adapt_sample_2489_noisy,عاجبك يعني الموضوع
adapt_sample_2490_noisy,ومذيعه
adapt_sample_2491_noisy,خلاص يا أمي سلام سلام دلوقتي سلام دلوقتي بسرعة بسرعة بسرعة بسرعة صدي دي صدي دي
adapt_sample_2492_noisy,قسم إيه
adapt_sample_2493_noisy,كنتو بتبعتوا كده بس أنا والله العظيم يا محمد خايف محمد كان معايا صلاة النبي يا جماعه
adapt_sample_2494_noisy,يعني إيه فتاة أحلام
adapt_sample_2495_noisy,الحب هو إتنين بيتقابلوا بينسجموا لبعض
adapt_sample_2496_noisy,أقصى درجه من درجات الحب
adapt_sample_2497_noisy,هنعملهم الإيه الوليمه زي ما إنتو شايفين
adapt_sample_2498_noisy,تضيق
adapt_sample_2499_noisy,لأ برضو هيبقى فيها مسؤوليه أكيد لإن إنت برضو إنت حد بقى هي مسئوله منك
adapt_sample_2500_noisy,بتشتغل مع أغلبهم بيبقوا جماعه برازيل يعني وفي عرب ساعات بتلاقي معاك يعني لو لقيت عربي يبقى ربنا بيحبك وإنت مبتتكلمش إنجليزي يبقى ربنا بيحبك يعني
adapt_sample_2501_noisy,اللي إنت
adapt_sample_2502_noisy,مورنينج عليك يا كايا
adapt_sample_2503_noisy,أهو شايفينه هو ده في ليه دور فوق وليه دور تحت أهو يا جماعه عشان مكتوب بالبرتغالي ترجمته بالعربي أهو
adapt_sample_2504_noisy,كهربا بتاع الزمالك بيجري في الملعب
adapt_sample_2505_noisy,إقلب الشبشب علشان ده كده حرام
adapt_sample_2506_noisy,بإذن الله
adapt_sample_2507_noisy,هتخش إنت بقى في الشارع ده أول ما تخش الشارع ده من عند العماره الصفره دي هتخش يمين هتلاقي المكتب على إيدك اليمين أظن مفيش أسهل من كده
adapt_sample_2508_noisy,زي ما يكون داخل بقصد إن هو يموت النمس
adapt_sample_2509_noisy,الله يسلمك
adapt_sample_2510_noisy,وما رضناش ندخل بالعربيه
adapt_sample_2511_noisy,ويعني يعني قوليلي أسمائهم الأول ها
adapt_sample_2512_noisy,هيلعب بره
adapt_sample_2513_noisy,ربنا يسترها عليكي
adapt_sample_2514_noisy,اللي هي تبقى بره من بره
adapt_sample_2515_noisy,يعني إحنا كلها هي بتاع ألف وتمانين حاجه زي
adapt_sample_2516_noisy,إيه ده بالرمود
adapt_sample_2517_noisy,بالعربي مش هيشغلك بنسبة صفر في الميه يعني العربي مش هيشغلك أصلا غير بقى مع اللي هو العمال اللي هو بس يشاورلك كده تحس بتتعامل خرس يعني مع إحترامي للخرس طبعا أنا مش قصدي تشبيه وحش ولكن هو لغة المشاوره يعني إن انتو تبقوا بتتكلموا وبتشاوروا لبعض فده مش حلو في الشغل إن انت مثلا يبقى عايز يقولك على حاجه فأنت مش فاهمه فلازم تروح لحد عنده عشان يشاورلك ويشرحلك فبتحس الأمور صعبه عليك تمام
adapt_sample_2518_noisy,عادي واحده عادي يعني
adapt_sample_2519_noisy,إنتي اللي قولتي
adapt_sample_2520_noisy,وإن شاء الله يبقى لينا الحلاوه بقى بعد
adapt_sample_2521_noisy,لسه بتجهزيها
adapt_sample_2522_noisy,ولسه متعملكش ساعات بيديك سبعميه وأربعين ساعات بيديك سبعميه وخمسين ساعات بيديك سبعميه وستين بس هو الحد الأدنى سبعميه وستين ده اللي الدوله حطاه اللي هو القانون بتاع الدوله إن انت متاخدش أقل من سبعميه وستين يورو تمام سبعميه خمسه وستين أعتقد مش ستين يعني سبعميه خمسه وستين قبل ما أنا أجي كان سبعميه وخمستاشر أو سبعميه خمسه وعشرين حاجه كده لكن بعد ما أنا جيت وقعدت فتره هما كانوا نزلوا تعديل على على الرواتب وخلوها سبعميه خمسه وستين يورو تمام ده أخر ده أخر حاجه أنا أعرفها يعني
adapt_sample_2523_noisy,بيعملها اللي هي بتبقى نص مقليه اللي هي تبقى من بره
adapt_sample_2524_noisy,سواء بقى إن كان فهد إن كان تعلب إن كان نمر أي حاجه
adapt_sample_2525_noisy,أه أه من عملية الغش أه
adapt_sample_2526_noisy,الجو
adapt_sample_2527_noisy,كنت في مره بتفرج عليه بره
adapt_sample_2528_noisy,عادي يعني لأ بلاش عشان أنا ممكن أفهمك بمية شعر الوقت
adapt_sample_2529_noisy,إيه
adapt_sample_2530_noisy,إنتي نفسك مش هيبقى ليكي في الكوره
adapt_sample_2531_noisy,وفرع في التجمع اللي إحنا فيه دلوقتي
adapt_sample_2532_noisy,نعم
adapt_sample_2533_noisy,في شغل بس الشغل مش عاجبك إنت مش عايز تتعب إنت عاوز تيجي تقعد على مكتب في أوروبا من الاخر عاوز الراجل أنا بجيبلكوا من الأخر
adapt_sample_2534_noisy,عندي ولدين وبنت
adapt_sample_2535_noisy,بسم الله الرحمن الرحيم
adapt_sample_2536_noisy,يا ستي خلاص إستني بس إستني
adapt_sample_2537_noisy,ها
adapt_sample_2538_noisy,فنبدأ كده أنا
adapt_sample_2539_noisy,عريس إنت عريس العريس لا مش عريس مش
adapt_sample_2540_noisy,أه فقاله إحنا معندناش حد بالإسم ده
adapt_sample_2541_noisy,مش هتحبس وبعدين إيه
adapt_sample_2542_noisy,صلي على النبي
adapt_sample_2543_noisy,فالمنظر ده بس ده كده فول على أبوه يعني
adapt_sample_2544_noisy,اللي إنت عايزه يا باشا هرد عليك
adapt_sample_2545_noisy,دكتور مين ده اللي عمل كده
adapt_sample_2546_noisy,ما هو أكيد مش أنا لسه هتعامل في حياتي وأكبر وأخش سنين
adapt_sample_2547_noisy,كان بياخد الفول ياخد وقت قد إيه في المستوقد ده
adapt_sample_2548_noisy,أهو تعالى محل أحذيه إسمه السبتو
adapt_sample_2549_noisy,ماشي أم بوز أحمر دي و إن شاء الله هو هو دي كده علامات و إن شاء الله دي كده
adapt_sample_2550_noisy,أنا هخش القسم
adapt_sample_2551_noisy,دي البطاطس بتاع كونسبت الفول والطعميه بيعملوا بطاطس بطاطس يعني يشتروا بطاطس ويقشروها ويقطعوها وبتاع
adapt_sample_2552_noisy,الأوراق دي غالبا كل الأوراق اللي إنت قدمتها غالبا كل الأوراق اللي إنت قدمتها
adapt_sample_2553_noisy,أنا قولت حاجه تهينك
adapt_sample_2554_noisy,أه ده الحب الحب لازما
adapt_sample_2555_noisy,فتاة أحلام دي
adapt_sample_2556_noisy,تخلص ثانوي وإنت تخرج من عنق الزجاجه
adapt_sample_2557_noisy,واحد صفر وأقولك أنا إسمها ايه فرقة نسيت الفرقه والله
adapt_sample_2558_noisy,إيه يعني عايزه إيه
adapt_sample_2559_noisy,مين اللي ينفع مساعد لحسن شحاته واحد من التلاته دول
adapt_sample_2560_noisy,الله ربنا يكرمك يا حبيبي
adapt_sample_2561_noisy,والبطه
adapt_sample_2562_noisy,لا لا والله
adapt_sample_2563_noisy,أني
adapt_sample_2564_noisy,إعمل من من بنها
adapt_sample_2565_noisy,منصحكش أبدا تمشي ورا المنحه الدراسيه وإنت مجموعك تحت التسعين في الميه سواء كنت نظام قديم أو جديد
adapt_sample_2566_noisy,نقاشين وبيطلبوا مش عا كل الصناعات وكهربائي وحداد ومش عارف إيه وعايز أقولكوا إن الدول الأوروبيه أكتر دول تقدر تعمل فيها فلوس
adapt_sample_2567_noisy,كام لاعب في المنتخب تعرفه
adapt_sample_2568_noisy,إيه علاقة المدرسه بالجبنه
adapt_sample_2569_noisy,تسمع عن الجوده الأوروبيه
adapt_sample_2570_noisy,شهر كريم عليكي
adapt_sample_2571_noisy,العيش عندهم طبعا متميز جدا عيش سندوتشات يعني هو دا العيش اللي بيطلع في السندوتشات
adapt_sample_2572_noisy,طيب ماشي
adapt_sample_2573_noisy,بإذن الله ربنا يكرمنا إن شاء الله روحنا وشوفنا المكان بإذن الله أيوه وعايناه
adapt_sample_2574_noisy,لسه عالمه
adapt_sample_2575_noisy,الشقيان
adapt_sample_2576_noisy,الله يسلمك سلم حسك
adapt_sample_2577_noisy,إنتي منين أساسا
adapt_sample_2578_noisy,البطه لأ
adapt_sample_2579_noisy,أيوه فإحنا إن شاء الله بإذن الله عاينا المكان وهننصب عليه إن شاء الله بإذن الله كده الليله دي أيوه ونصطادوه
adapt_sample_2580_noisy,اللي إنتو تعملهولي
adapt_sample_2581_noisy,أحمد حسن
adapt_sample_2582_noisy,أنا عايز أخش أوريكوا بقى اللي هو سلامو عليكو سلام ورحمة
adapt_sample_2583_noisy,هو المكان اللي هو يعتبر ساكن فيه لإن هو ده أقرب مكان بوص وكلام من ده ساكن فيه
adapt_sample_2584_noisy,عشان متبقاش سرسجي
adapt_sample_2585_noisy,حاجه
adapt_sample_2586_noisy,أه والله
adapt_sample_2587_noisy,خلاص
adapt_sample_2588_noisy,أيوه
adapt_sample_2589_noisy,فتاة الأحلام كنا
adapt_sample_2590_noisy,بجد والله
adapt_sample_2591_noisy,محمد صلاح بيلعب إيه
adapt_sample_2592_noisy,معلش
adapt_sample_2593_noisy,واخد بالك
adapt_sample_2594_noisy,يا جماعه
adapt_sample_2595_noisy,ماشي أهي ده العنوان و ده رقم التليفون إسم المدرسه فيلشبونه ده العنوان ورقم التليفون تقدر تاخدها سكرين شوت وتوريها لأي حد هيوصلك ليها أو إنت تكتبه على جوجل مابس هيوصلك
adapt_sample_2596_noisy,هتيجي يعني
adapt_sample_2597_noisy,هتغازل البنت اللي إنت هترتبط بيها تقولها إيه مثلا
adapt_sample_2598_noisy,أو ساعات الخازوق بيطول معاك وتلبس
adapt_sample_2599_noisy,محمد ها
adapt_sample_2600_noisy,بقولك إيه متعمليش أكل النهارده عشان أنا جايبلك أكل من أوبرهيدز
adapt_sample_2601_noisy,إيه رأيك في الحب
adapt_sample_2602_noisy,معظم مطاعم الفول تقريبا من تسعه وتسعين في الميه منها بيعملوا فول مطحون تعالى
adapt_sample_2603_noisy,ماشي
adapt_sample_2604_noisy,بعد شويه هيبقى معايا عم بشندي هيكلمنا عن تفاصيل أوي اللي مخلياهم من التمانينات في الحته دي
adapt_sample_2605_noisy,في التحرير إم
adapt_sample_2606_noisy,يا مسير
adapt_sample_2607_noisy,إيه يا رضوى بقولك إيه يا رضوى وأنا نازل الجامعه النهارده علشان أشتري مذكرات طلع كان في إمتحان مفاجئ
adapt_sample_2608_noisy,عشان هو بيطير في الشارع
adapt_sample_2609_noisy,أه كان هو اللي هيشتري الماتش
adapt_sample_2610_noisy,أه
adapt_sample_2611_noisy,إعملي
adapt_sample_2612_noisy,مبتعرفش هتروح بقى المكتب بقى إيه الخدمات اللي هو بيقدمهالك بيساعدك وبيجيبلك شغل أه في حاجه تاني
adapt_sample_2613_noisy,ربنا يسامحك على الفضيحه يا رضوي
adapt_sample_2614_noisy,وإن شاء الله وراه لغاية ما نصطادوه إن شاء الله
adapt_sample_2615_noisy,كان وراها شخص محب ومخلص ألا وهو البارون إمبان
adapt_sample_2616_noisy,نورت يا حاج نورت يا حاج ليكي في الكوره ولا ملكيش
adapt_sample_2617_noisy,لأ لينا ملناش ليه ليكي طبعا
adapt_sample_2618_noisy,أسب الدين
adapt_sample_2619_noisy,وروحتله إديته الأوراق ديت هيعرف ياخدلك موعد لإن الموضوع مش إن إنت تقدم وبس الموضوع إن إنت تقدم ويتم قبولك إنت فاهم يقولولك إحنا استلمنا الورق بتاعك ده مهم جدا مش إن أنا احط الأوراق وخلاص ما أي واحد ممكن يحط الأوراق بتاعته
adapt_sample_2620_noisy,برافو عليك والله سقف لنفسك
adapt_sample_2621_noisy,خلص الطبق عشان يستغفرلك
adapt_sample_2622_noisy,طيب دي معلومه مهمه جدا
adapt_sample_2623_noisy,صح
adapt_sample_2624_noisy,وفي ناس بتيجي وبتقعد وبتشتغل بجد وبتاخد عقد والشركه هي اللي بتدفع الضرايب بتاعتها
adapt_sample_2625_noisy,اللي جرب غير اللي ما جربش
adapt_sample_2626_noisy,تاني بوق
adapt_sample_2627_noisy,قولي خمس أغاني كده لعبد الحليم
adapt_sample_2628_noisy,أه
adapt_sample_2629_noisy,إنتي هتيجي تعملي إيه
adapt_sample_2630_noisy,أحسن من مين
adapt_sample_2631_noisy,عايز أجيب تلات أسئله
adapt_sample_2632_noisy,لأ إستنى نسبوها عشان الطريق
adapt_sample_2633_noisy,مش من حقه إن هو يرجعك أصلا إنت ليه يا عم عندك مشكله عندك حاجه أه هيرجعك حد مبلغ عنك هيرجعك معندكش مشكله وواخد تأشيره
