audio,transcript
adapt_sample_961_clean,في مواهب عندنا يعني إحنا عندنا لعيبة كوره
adapt_sample_962_clean,أيوه يا با ادعيلي
adapt_sample_963_clean,إنما فيها أشياء مدبره لناس كبار إم عارفين يلموا ناس
adapt_sample_964_clean,قالتلي يا عبدالرحمن هتروحنا قولتلها لا قالتلي وحياة فاطمه قنديل ضم عيالك روحنا
adapt_sample_965_clean,يعني إيه ورم على الكبد يا دكتور
adapt_sample_966_clean,وأنا عندي تلات بنات عارف
adapt_sample_967_clean,يلا ياد أنت وهو ياد شدوا حيلكم عشان نروح بدري
adapt_sample_968_clean,المهم قعدت استاذه منى عجبها المش القديم
adapt_sample_969_clean,لغاية الليلادي إم
adapt_sample_970_clean,فلازم بت الضوي أول واحده تروح تتجوز بيه واي فاي
adapt_sample_971_clean,الله يباركلك الله يباركلك يا عم صلاح
adapt_sample_972_clean,إحنا وقفنا سندنا نعم إحنا وقفنا سندنا
adapt_sample_973_clean,بتاخد فيجا
adapt_sample_1699_noisy,في يعني الوقت اللي انت مناسب ليك بعد شغلك طيب عنوان المدرسه دي فين خليت الست برضو كتبتهالي بس <fil> بالبرتغالي أنا ما بعرفش البرتغالي على فكره
adapt_sample_1700_noisy,قل أدبه ما دكتور موت يا محمد
adapt_sample_1701_noisy,لا خلاص كده بقى خدت بعضي وخدت العيال وروحت
adapt_sample_1702_noisy,يروح بقى واخد الأوراق منك و راح هو المكتب ما أنت جديد يا عم متعرفش حاجه و اللي بيقولك
adapt_sample_1703_noisy,اللي جاي دايما أحلى إن شاء الله
adapt_sample_1704_noisy,لو فتاة أحلامك قالتلك أنا مش موافقه عليك عشان انت سرسجي هترد تقولها إيه
adapt_sample_1705_noisy,دخلت في موضوع تاني أنا أنا بكلمكوا لأن أنا
adapt_sample_1706_noisy,إيه يا أمي
adapt_sample_1707_noisy,إزيك يا حبيبي عامل إيه
adapt_sample_1708_noisy,بصوا أهو عامل زي البودره السوده كده و طبعا زي ما إنتو شايفين كده
adapt_sample_1709_noisy,مين
adapt_sample_1710_noisy,مجموعة الهبدات الإلكترونيه
adapt_sample_1711_noisy,بتعملي إيه
adapt_sample_1712_noisy,أسرع
adapt_sample_1713_noisy,والسينما بتاعت امبارح
adapt_sample_1714_noisy,الكلمات دي
adapt_sample_1715_noisy,جوده أوروبيه
adapt_sample_1716_noisy,نلغيه
adapt_sample_1717_noisy,ماشي
adapt_sample_1718_noisy,أنا بإذن الله هطلع مهندس
adapt_sample_1719_noisy,أه واضح أهو ممكن تعمل بحث عليه و تعرف هو فين بالظبط موجود في البرتغال كلها ده
adapt_sample_1720_noisy,شوكه
adapt_sample_1721_noisy,لا
adapt_sample_1722_noisy,عارف الدنيا رايحه فين وجايه منين ولا بكتب ولا محضر ورقه ولا محضر قلم ولا الكلام ده
adapt_sample_1723_noisy,هنقلي
adapt_sample_1724_noisy,أقسم بالله تلات سنين وهتاخد على وشك
adapt_sample_1725_noisy,حبلت معاه وجابت معاه ولد وبنت
adapt_sample_1726_noisy,عم بشندي احنا فرعين أه
adapt_sample_1727_noisy,بنشكرك يا فندم على اللقاء الجميل ده وحابين بس نقولك إن شاء الله متسبيش المطبخ
adapt_sample_1728_noisy,الله يباركلك
adapt_sample_1729_noisy,الله
adapt_sample_1730_noisy,بيلموا عشان يسلموا فإذا لحد دلوقتي الناحيه التجاريه مفيش هواه واقع طبعا مادام في شروق أعرف إن الصالون النهارده هيكون حركته ضعيفه
adapt_sample_1731_noisy,الحاجه التانيه بقى بعد ما لو ناقصك ورقه بيقولولك ناقصك ورقه بيعملوهالك بيساعدوك في شغل بيدوك مثلا ورقه زي دي في الورقه دي تاخدها من عندهم تروح بيها لأي مدرسه توريهالهم مدرسه معينه توريهالهم بتاخد دور عشان تدرس اللغة البرتغالي بتدرسها في الوقت اللي انت عاوزه في فترات الصبح في الضهر
adapt_sample_1732_noisy,الحمد لله جاي اهو
adapt_sample_1733_noisy,الله
adapt_sample_1734_noisy,أنا في القسم دلوقتي تعاليلي
adapt_sample_1735_noisy,تمام الفيش والتشبيه شهادة الشنطه اللي هي السكن تمام أه الباسبور بتاعك طبعا ده بيبقى في اللي هي الصوره لو انت داخل ليجل لو انت داخل قانوني
adapt_sample_1736_noisy,وبعد كده بعدها بشويه ينزلوها تاني في الزيت
adapt_sample_1737_noisy,إن شاء الله أحسن حلاوه
adapt_sample_1738_noisy,إنت كنت فين
adapt_sample_1739_noisy,هاجي أحط مثلا إن أنا مسافر من بلدي يبقى هعمل خمس تيام في روما
adapt_sample_1740_noisy,ده بجنيه بجنيه واحد بس إنت بقى عايز تجيب خمسه تجيب سته زي ما إنت عايز ده بجنيه
adapt_sample_1741_noisy,لو دخلت عليها بهديه إنت جايبها
adapt_sample_1742_noisy,يلا يا باشا ما احنا مع بعض
adapt_sample_1743_noisy,ببلاش إلا لو انت بقى عايز تدخل عيالك مدارس خاصه ده موضوع تاني فده عموما ملخص الجمعيه أو إدارة الهجره اللي هي بتساعد الناس
adapt_sample_1744_noisy,عادل شكل
adapt_sample_1745_noisy,و إن شاء الله بإذن الله نجيبوه دي العلامه إن شاء الله بإذن الله
adapt_sample_1746_noisy,لإن إنت لما بتيجي وانت متعرفش حاجه بتقابل واحد معندوش ضمير أه إنت لسه جاي جديد أه عايز تعمل أوراق هو عارف بقى فين الأمان أه بالنسبه بقى للأوراق
adapt_sample_1747_noisy,وأدي الجره أهي مش طبيعيه اللي هي إيه سورة الحافر كده بمغريه أهي
adapt_sample_1748_noisy,ايوه حلو قوأ
adapt_sample_1749_noisy,زعلت اللي انا قولتلها ما انا كنت قادر واخدهم وامشي عشان فرحتها هي ما رضيتش اخدهم سرقه
adapt_sample_1750_noisy,افتكرت حاجه يا راسي وبعدين نرجع نكمل بس حاجه مهمه ناس عماله تقولي المكتوب فين المكتوب فين المكاتب هو انا لما بقولك مكتب بيخلص الأوراق هو المكتب ده بيعمل كده على الملأ يعني مكتوب كده عليه
adapt_sample_1751_noisy,مذيعه كانت طالعه التليفزيون بتقول إن الغده النخاميه بتتواصل مع الكون وبتعمل حاجات كده
adapt_sample_1752_noisy,ناكلها لوحدها
adapt_sample_1753_noisy,صور عمك يا محمد يلا
adapt_sample_1754_noisy,مش هيقبل الأوراق فهو بيعمل إيه بيقدملك العقد ده و بعد ما بيقدمهولك هو بيلغيه يقوله أنا و الله جربته و منفعش معايا طب و أنا بعد كده هعمل إيه بقى بعد كده انت بتدور على شغل بتدور على شغل بجد تاخد عقد حقيقي
adapt_sample_1755_noisy,ماشي
adapt_sample_1756_noisy,إن شاء الله
adapt_sample_1757_noisy,اللي هي خدمات المهاجرين أو خدمات الأجانب في في دائرة الهجره
adapt_sample_1758_noisy,بصراحه
adapt_sample_1759_noisy,يلهوي دي نفس يا باشا
adapt_sample_1760_noisy,إنتي رايحه فين
adapt_sample_1761_noisy,اتشتمت
adapt_sample_1762_noisy,و على فكره في جامعات حكوميه كتير في أسبانيا مش بتحتاج ولا لغه و لا سنه تحضيريه ممكن تجيب ورق ثانوي وتدرس على طول الناس اللي هتسأل عن جودة التعليم في إيطاليا هي جودة التعليم في إيطاليا طبعا كويسه جدا و لكن المشكله إن كل جامعه
adapt_sample_1763_noisy,البوك اللي هو البوكي ده
adapt_sample_1764_noisy,أنا طبعا قدامي سندوتشات العيش يا جماعه العيش بالمناسبه إحنا القاعده اللي انا قاعدها دي مش موجوده هما بيعملوا سندوتشات فقط وتيك واي و كده أنا بس اللي يعني كان لازم أقعد معندهمش القاعده دي
adapt_sample_1765_noisy,اتنين تلاته عارفهم شكلا كده
adapt_sample_1766_noisy,متعمليش أكل النهارده عشان أنا هجيب أكل النهارده من أوبر
adapt_sample_1767_noisy,من إيه
adapt_sample_1768_noisy,عندها كام سنه
adapt_sample_1769_noisy,و ضربته و عورته و عايز غرامه ألف جنيه و ابعتيلي أبويا دلوقتي
adapt_sample_1770_noisy,مع بقية الورق بس أنا أنا بدي نسبة خمسين في الميه إن إن الورق ده هيتقفل إيه بقى نسبة خمسين في الميه إيه الوقت ده
adapt_sample_1771_noisy,خلاف الحاجات اللي أنا كنت بشتريها عاوز اشتري تيشيرت عاوز اشتري بنطلون عاوز اشتري بنطلون أي حاجه كنت بشتريها كنت بشتريها مبشتريش كاش
adapt_sample_1772_noisy,و اللي هو عم بشندي أصلا يعني هو طبعا ما شاء الله من كتر ما هو الاسم
adapt_sample_1773_noisy,بتلاتين
adapt_sample_1774_noisy,إنت لما تكون لسه معملتش إقامه وعايز تتعلم اللغه بتدفع فلوس كتير الساعه بخمسه وعشرين يورو يعني أربع ساعات بمية يورو
adapt_sample_1775_noisy,الحقيني يا ماما
adapt_sample_1776_noisy,ليه بقى أنا طول ما أنا بشتري هو شايف إن أنا بشتري هو شايف إن أنا عايز أحط بنزين للعربيه بحطه في كارت البنك
adapt_sample_1777_noisy,و لكن بالنسبه برضو خلينا نرجع العقد الإكتفيتي تقدر تعمله ببلاش بس في حاجه لو انتو هتعملو عقد حر
adapt_sample_1778_noisy,الموضوع هيجي عليك بخساره أصلا هتدفع فلوس إم
adapt_sample_1779_noisy,أنا من سوق هنا بقالي أكتر من ساعه منتظر و الله كل شويه أقول إيه طب استنى شويه الدنيا تظبط و بعد كده نصور التقرير طب استنى شويه الدنيا تظبط تصور التقرير لكن من ساعة ما نزلت
adapt_sample_1780_noisy,بعد كده فتحت المحل
adapt_sample_1781_noisy,من ضمن الحاجات اللي أنا فكرت فيها التوقيت اللي أنا أقدم فيه أنا عاوز أقدم
adapt_sample_1782_noisy,لغه تانيه يا باشا
adapt_sample_1783_noisy,في نفس الوقت أنا مش عايز أترفض أنا عاوز إن شاء الله ربنا يكرمني وأخدها
adapt_sample_1784_noisy,المهم إيه التوقيت اللي أنا أقدر أقدم فيه الورق للسفاره بكون عندي نسبه بنسبة خمسين في الميه إن الورق ده هيتقبل طبعا
adapt_sample_1785_noisy,طب بابا ده كان مقلب
adapt_sample_1786_noisy,هنتغلب النهارده
adapt_sample_1787_noisy,فإحنا اللي يهمنا إن إحنا ناخد التأشيره ناخدها بقى في وقت تلج ناخدها بقى نروح في توقيت غلط إنت عايز تاخدها
adapt_sample_1788_noisy,اللي عايز التقرير في كلمتين بالظبط على رأي الله يرحمه فؤاد المهندس كلمتين وبس سوق النهارده مش قد كده مش أحسن حاجه لو لسه منزلتش خليك في البيت
adapt_sample_1789_noisy,ولا أحمد حسن
adapt_sample_1790_noisy,بس كبير كبير خالص
adapt_sample_1791_noisy,دي بقى يا جماعه اللي هي الخطه الأولانيه اللي هي الخطه التانيه بقى اللي بتجيب من الاخر بتجيب من الآخر بس أهم حاجه تكون حذر و أنت شغال بيها يا جماعه ماشي إحنا خلصنا الجبس و السكر و ميه قولتلكوا على بعد اتنين متر
adapt_sample_1792_noisy,بالراحه
adapt_sample_1793_noisy,و الله هيدخلني القسم يا ماما أعمل إيه
adapt_sample_1794_noisy,طب مرع البطه بص يا محمد تعالى بص البطه
adapt_sample_1795_noisy,طب ما تورينا عاملها إزاي
adapt_sample_1796_noisy,إيه بوك ده معلش
adapt_sample_1797_noisy,جنوب أفريقيا
adapt_sample_1798_noisy,الاختراع اللي نعمله عشان نكسب بعد كده
adapt_sample_1799_noisy,خلصي امتحان
adapt_sample_1800_noisy,حب عادي يا ماما أقوى مسا عليك يعني ياما أكلتينا
adapt_sample_1801_noisy,الخدمات اللي هو بيقدمهالك أولا بيساعدك في الأوراق بيجيبلك شغل اللي متوفر عنده
adapt_sample_1802_noisy,من أقل أيام الحد اللي جت عليا في الحدات اللي كلها اللي فاتت
adapt_sample_1803_noisy,لا لا انا مش سرسجي
adapt_sample_1804_noisy,اللي هو
adapt_sample_1805_noisy,لكن الصنايعيه بيكون ليهم أجور تانيه الصنايعيه بيكون باليوم بالمتر يعني بتاع السيراميك مثلا بيتحاسب بالمتر
adapt_sample_1806_noisy,فتلاقي مثلا واحد بيفرش أنتيكات اللي هي التماثيل المصري القديم والكلام ده
adapt_sample_1807_noisy,يا جماعه ده فول فول فول بلدي فول مدمس مش مطحون فول
adapt_sample_1808_noisy,رقبتنا ليك يا عم موسى
adapt_sample_1809_noisy,السجاير مبتفطرش في رمضان
adapt_sample_1810_noisy,أه
adapt_sample_1811_noisy,إيه بوك دي يا باشا
adapt_sample_1812_noisy,بس طبعا الفهد بيبقى المعامله معاه أصعب من النموس بكتير
adapt_sample_1813_noisy,سلامة الله
adapt_sample_1814_noisy,و في مناطق بتركب لها ترام يعني على حسب المكان اللي إنت رايحه على على حسب بقى إنت جاي منين أنا مش عارف إنت جاي منين يعني
adapt_sample_1815_noisy,يا لهوي يا أحمد أنا كنت مستني الإجابه دي من بدري
adapt_sample_1816_noisy,وإن انت ما بتطحنش الفول
adapt_sample_1817_noisy,يلا بينا على الكوبري التاني
adapt_sample_1818_noisy,لا لا أه
adapt_sample_1819_noisy,ماشي
adapt_sample_1820_noisy,هو ده فول بالإيه ده فول بالإيه
adapt_sample_1821_noisy,بيحتاجوا يشوفوا التأشيره اللي انت جاي بيها سواء من أسبانيا سواء من فرنسا من بلجيكا من ألمانيا من السويد من أي دوله في الاتحاد الأوروبي في السته و عشرين دوله ما فيش مشكله مش شرط تكون واخدها للبرتغال لو واخدها لأي دوله عادي أمورك طيبه
adapt_sample_1822_noisy,يعني أنا في رأيي يعني ممكن نقول أحمد حسن
adapt_sample_1823_noisy,إيه
adapt_sample_1824_noisy,أيوه القلب وما يريد يبقى كده في واحده
adapt_sample_1825_noisy,اللعيبه نفسهم بقى ليهم في المطبخ
adapt_sample_1826_noisy,أنا زملكاوي
adapt_sample_1827_noisy,طب كلمي باباك اعملي أي حاجه
adapt_sample_1828_noisy,ها
adapt_sample_1829_noisy,طب إنتي نفسك في إيه
adapt_sample_1830_noisy,قولوا للجبن بو
adapt_sample_1831_noisy,أه بضرب المراقب
adapt_sample_1832_noisy,كان نزله
adapt_sample_1833_noisy,السيد
adapt_sample_1834_noisy,ربنا يستر
adapt_sample_1835_noisy,واسمع مني لو هتضيع السنه بس هتوصل في الاخر للحاجه اللي إنت حاطط امالك كلها فيها وبتحبها وهتكمل أهون عشر مرات من إنك تعصر على نفسك لمونه وتكمل في حاجه مش حاببها بس مجموع الجبهه وخلاص
adapt_sample_1836_noisy,وطني
adapt_sample_1837_noisy,ينسجموا لبعض
adapt_sample_1838_noisy,أوعى تخاف
adapt_sample_1839_noisy,والله أنت عسل
adapt_sample_1840_noisy,و الله هو واحد كان قاعد فاضي كده كان قاعد بيعمل حمام قالك إيه افتكس افتكاسه قالك انت خلاك وحشه اتنين
adapt_sample_1841_noisy,هو خلاص خرج من عنده أيوه المفروض أنا متابعه
adapt_sample_1842_noisy,إمتى بقى أنا هسافر مثلا هسافر يوم عشره الطياره بتاعتي هتطلع يوم عشره أو اللي أنا حاجزها يبقى هعمل حجز للفندق من يوم خمسه ليوم عشره حلو الكلام
adapt_sample_1843_noisy,أنا صريح معاك
adapt_sample_1844_noisy,لا لا لا
adapt_sample_1845_noisy,اشوف الكواليس
adapt_sample_1846_noisy,السيستم الأوروبي أو الطريقه الأوروبيه ما بتكونش بالطريقه دي يعني بيكون إنت مثلا بتحددلك بلان إن إنت ألف بيتين ده إنت هتعمل كذا كذا كذا شكرا ما فيش إضافات الحاجات اللي هو طب معلش خليها علينا طب معلش المرادي ساعدني في دي طب معلش خليها الشغل ده مش موجود غير عند العرب بس اللي هو
adapt_sample_1847_noisy,و على فكره الجامعات في بولندا مش بتحتاج و لا لغه و لا سنه تحضيريه ممكن تاخد أوراقك بتاعت الثانوي وتترجمها وتقدم وتدرس على طول لأ و كمان في بولندا تقدر تدرس بالانجليزي عادي طب و لو أنا الميزانيه عندي مفيش
adapt_sample_1848_noisy,بابا بيقولي ما تلعبش مع الناس في الشارع عشان بتطلع متعور وبتوسخ هدومك كنت بنزل ألعب عادي ومطلعش هدوم
adapt_sample_1849_noisy,و إن شاء الله نغلب بكره و أنا باخد من باب مغلوب و لا باخد
adapt_sample_1850_noisy,ربنا أكرمنا الحمد لله الست الأميره الطيبه دي زي ما شفنا و يعني مرض بواب و هي بتشتغل بواب هي كمان و على قد حالهم و رمضان كريم و رمضان بيحب الخير دوروا على أهل الخير اللي هما عندهم عفه
adapt_sample_1851_noisy,أه وادوني حاجه على اللي انا دفعته ده
adapt_sample_1852_noisy,أهلا ومرحبا بكم في حلقه جديده من برنامج شوارع القاهره برنامج شوارع مصر بقى مش القاهره لأن مصر تشمل كل المحافظات إحنا اليوم في محافظة المنوفيه على الكوبري
adapt_sample_1853_noisy,بالراحه ربنا يسترها يارب
adapt_sample_1854_noisy,عملت إيه بقى
adapt_sample_1855_noisy,بيلعب إيه
adapt_sample_1856_noisy,إيه
adapt_sample_1857_noisy,ألف سلامه عليك
adapt_sample_1858_noisy,بتقدم على الشنجن صعب تاخدها متعددة الدخول إلا لو كنت رجل أعمال
adapt_sample_1859_noisy,إيه اللي انت قولته
adapt_sample_1860_noisy,تمام
adapt_sample_1861_noisy,بس بلاش تشتم
adapt_sample_1862_noisy,أو كنت راجل مثلا هتعمل بيزنس أو هتعمل حاجه
adapt_sample_1863_noisy,عاشت الأسامي يا ست سعديه وعندي كام سنه يا ست سعديه
adapt_sample_1864_noisy,على الكافيه طبعا
adapt_sample_1865_noisy,يبقى أنا كده فعلا معييش إن أنا رايح أعمل سياحه أنا هقعد في روما خمس تيام و عندك تذكره و هتراجعها بالتواريخ و حجز الفندق هتلاقيهم تمام
adapt_sample_1866_noisy,أنا ما أصطادتش حاجه كبيره بالطريقه دي قبل كده
adapt_sample_1867_noisy,هفضل زي ما أنا
adapt_sample_1868_noisy,ده بقى و الكلام ده
adapt_sample_1869_noisy,من روما هروح ميلانو هحجز من ميلانو على بلدي إحنا كده معانا كام حجز للطيران اللي أنا عملته
adapt_sample_1870_noisy,و كل الساده المشاهدين
adapt_sample_1871_noisy,بس إن شاء الله
adapt_sample_1872_noisy,راس حربه
adapt_sample_1873_noisy,يعني الحمد لله
adapt_sample_1874_noisy,جبتهولك أهو
adapt_sample_1875_noisy,تلاته صفر
adapt_sample_1876_noisy,عم محمد
adapt_sample_1877_noisy,ده كام سنه
adapt_sample_1878_noisy,قالتلي مامتك كده وهي بتقولك خد الجبنه يا حبيبي عشان تروح بيها المدرسه
adapt_sample_1879_noisy,لكن أول مره وتاخدها متعددة الدخول
adapt_sample_1880_noisy,يعني أنا هاكل لوحدي
adapt_sample_1881_noisy,فخلاص بقى أنا كده حجزت خمس تيام كمان في ميلانو هسافر من ميلانو بقى على إيه على بلدي يبقى أنا حجزت تلات مرات
adapt_sample_1882_noisy,بس مش علشانها علشان انا عاوز كده
adapt_sample_1883_noisy,و حجز طيران بعد خمس تيام بقى من ميلانو هنقول إن احنا هنروح عشر تيام
adapt_sample_1884_noisy,وهعمل زي ما هما بيعملوا
adapt_sample_1885_noisy,ما بقولك يا عم بمناسبة ىالهبد بقى
adapt_sample_1886_noisy,لا والله مش النهارده لما الحلقه تنزل
adapt_sample_1887_noisy,ماشي ساب المنتخب بس كان في المنتخب
adapt_sample_1888_noisy,دي الفوطه اللي بتبيعيها
adapt_sample_1889_noisy,عايزك تلحنلي الجمله دي جبنه بيضا مصريه بجوده أوروبيه
adapt_sample_1890_noisy,يعني حاجه جودتها عاليه هو ده الأيزو
adapt_sample_1891_noisy,طب ابعتهولي عند قسم العباسيه عشان اتخانقت مع المراقب وعملي محضر في القسم دلوقتي
adapt_sample_1892_noisy,مات
adapt_sample_1893_noisy,النهارده هتلاقي ما فيش لم ما فيش أسعار الإتنين يعني ما فيش لمو ما فيش أسعار يعني ما فيش طلب على حاجه ما فيش أسعار لحاجه هو لما يلاقي حاجه بقى فلتة حاجه إيه فلتة عجبته و بسعر لقطه شفته كده مثلا ما صورنا قبل كده الجزء الفنش أبو ألفين قولتلكوا حد اشتريها بسعر لقطه بألف ومتين
adapt_sample_1894_noisy,يا با
adapt_sample_1895_noisy,تريزيجيه بيعمل إيه
adapt_sample_1896_noisy,ألو
adapt_sample_1897_noisy,كبده
adapt_sample_1898_noisy,لسه هنتكلم في تفاصيل كتير زي ما قولتلكوا ولكن
adapt_sample_1899_noisy,فدي أول حاجه أنا فكرت فيها إن أنا لما أجي أقدم أنا هقدم في الوقت اللي هو في التلج ده هقدم في الشتا يعني الشتا إمتى يعني في أكتوبر
adapt_sample_1900_noisy,الحمد لله
adapt_sample_1901_noisy,ألو
adapt_sample_1902_noisy,أيوه
adapt_sample_1903_noisy,لا يا حبيبتي أنا مبكلش من الشارع يا حبيبتي
adapt_sample_1904_noisy,هو أنت ينفع تاكل معايا ولا
adapt_sample_1905_noisy,والوضع على ما هو عليه والوضع عباره عن إيه أولا لو مسكنا أول حاجه عدد الهواه هو قليل جدا النهارده عدد الهواه قليل جدا يعني يتعدى على سبعه جنيه الواحده
adapt_sample_1906_noisy,جوزك شغال بواب العماره
adapt_sample_1907_noisy,ماشي يا محمد
adapt_sample_1908_noisy,أه الكاميرا الخفيه
adapt_sample_1909_noisy,أرفع الفستان وأقرص ميهمنيش
adapt_sample_1910_noisy,سوشي سي سي فود
adapt_sample_1911_noisy,وبعد كده إيه اللي حصل بعد كده
adapt_sample_1912_noisy,ده كان مختصر أسبوع عشان الناس عايزه إيه كلمتين و تخرج كده إنت أخدت المفيد اللي عايز بقى يسمع الكلام اللي هقوله عن السوق يقدر يتواصل معانا بس هتكلم في إيه المفيد أهو في كلمتين
adapt_sample_1913_noisy,بس
adapt_sample_1914_noisy,و الله و من ناحية وسخ فهو وسخ بقى ربنا يسامحه المهم انا في القسم دلوقتي اعمل ايه طيب
